/ru/company/ruvds/blog/558916/,"котики,информационная безопасность,nft,квест,игра,Блог компании RUVDS.com,ruvds_анонсы","Информационная безопасность,Хостинг,IT-инфраструктура",False,ruvds,ru_vds,22,0,0,11000,31,"Коллаж из картинок художника beeple держит сегодня рекорд по стоимости среди всех проданных цифровых NFT-произведений.

NFT — одна из самых горячих тем в мире блокчейна. Кто-то уже заработал на них миллионы долларов, кто-то потерял сотни и тысячи. Одни называют NFT революционным изобретением, которое изменит сферы разработки игр и наше восприятие цифровых (нематериальных) объектов. Другие недоумевают, как можно вестись на такой развод и платить мошенникам деньги. Но вне зависимости от того, кто прав, факт остаётся фактом: NFT сейчас на слуху, и их оборот достиг уже очень внушительных сумм. 

Вот и у одного нашего друга на ноуте осталась классная гифка с танцующим котиком, к которой прикручен NFT. Вещь штучная, уникальная, через пару лет за неё можно будет немало выручить. Правда, вытащить с ноута гифку будет трудно. Подробности под катом.

Что за NFT такое?
NFT расшифровывается как non-fungible token, то есть невзаимозаменяемый токен. Идея в том, что есть взаимозаменяемые объекты, которые полностью идентичны друг другу — например, один рубль равен другому рублю, — а есть невзаимозаменяемые объекты, каждый из которых уникален и неповторим. Скажем, когда вы пришли в магазин и купили новые кроссовки, они в этот момент взаимозаменяемы: полностью идентичный любым кроссовкам того же размера. А когда вы их поносите, то эта пара станет уникальной за счёт невоспроизводимых потёртостей и прочих изменений, то есть кроссовки станут уникальными — других таких же во всём мире нет, есть только похожие.

На принципе уникальности держится вся торговля предметами материального искусства. Например, даже если художник нарисует точную копию какой-либо картины, пусть и своей же, это всё равно будут две разные картины, хоть и очень похожие. А электронные объекты обычно взаимозаменяемы — Ctrl+C, Ctrl+V, и вот у тебя уже идеальная копия какой-нибудь гифки или песни, попробуй найди два отличия. 

В результате придумали NFT — это блокчейн, который можно прикрепить к любому нематериальному объекту — картинке, видеозаписи, музыкальному файлу, предмету в игре — и тем самым заявить, что этот объект уникален и принадлежит только вам. Скопировать такой объект можно, но выдать за свой уже не получится — ваш NFT не позволит. Эдакий сертификат уникальности. Прикрутить токен можно не только к цифровому, но и к материальному объекту. За это нужно благодарить смарт-контракты Etherium, именно эта крипта лежит в основе большинства NFT.

Сегодня за цифровые произведения искусства с NFT уже платят десятки миллионов долларов. Рекорд пока что у художника Майка Винкельмана, выступающего под псевдонимом Beeple — его коллаж из 5 тысяч изображений на аукционе Christie продали аж за $69 млн. За цифровую картинку с токеном:


Другой известный пример — продажа NFT мема с летающим котиком:

Этот мем продали за 580 тыс. долларов. Не спрашивайте, зачем. Мы сами недоумеваем.

Вот ещё: компания Injective Protocol подогрела NFT—хайп, купив у Бэнкси картину за $95 тыс., прилюдно сожгла её и привязала к цифровой копии NFT. Теперь этот набор пикселей принадлежит компании, которая объявила его настоящим произведением криптоискусства. 

То есть NFT успел стать важным фактором в торговле произведениями искусства разной степени ценности (или сомнительности). Существуют разные электронные площадки, на которых все желающие могут покупать и продавать NFT. И цены на них сильно варьируются. Однако есть важный момент: в NFT хранится не сам цифровой объект, а только его описание и свидетельство собственности. Это уже приводит к забавным ситуациям, когда кто-то покупал токен, причём за вполне себе ощутимые суммы, а… сам объект неожиданно исчезал. 


Так что если вы надумали податься в криптоколлекционеры, то хорошо подумайте над целесообразностью. И заодно проверяйте, за какие же токены вы платите.

Большую популярность NFT снискали в мире игр. Токены прикрепляют к различным игровым объектам — оружию, доспехам и прочему добру — и продают как уникальные объекты, имеющие конкретного владельца внутри конкретной игры. Владельца не авторских прав, а игрового предмета. Некоторые поклонники NFT мечтают о светлом дне, когда токены станут универсальными и можно будет применять в играх предметы из других игр. Купил себе автомат в каком-нибудь шутере, а потом зажёг с ним в фэнтезийной РПГ.

Сегодня многие пророчат NFT светлое будущее гаранта авторских прав в условиях повального копирования изображений, видео, книг и музыки и прочих произведений. Но столь же активно технологию критикуют как очередной инструмент выманивания у простаков денег. Кто прав, покажет время. 

Образец дегенеративного криптоискусства, за который кто-то заплатил пару десятков баксов.

А пока что вы можете совершенно бесплатно заполучить классную гифку с NFT, которая скоро может быть безвозвратно уничтожена совершенно варварским способом. Причём уничтожена вместе с хорошим дорогим ноутбуком и отличным роялем. Все подробности тут.

 ▍UPD. 24 мая 15.55:

Наш друг пишет: 

Я дошел до коворкинга, попробовал получить доступ, и тоже не смог… 

Хотел было уже звонить бывшей, но… Беда не приходит одна (( 

За то время, что ноутбук был в руках моей бывшей, его успели взломать. Это сделала группа хакеров под названием “sp0rk b4gel”. Их целью были исходные коды по ИИ с моего ноутбука (помнишь, я говорил тебе, что работаю на одну очень серьезную корпорацию), и они их успешно похитили…

Мой криптокотик им был ни к чему, они его даже не заметили, потому что пришли за другим. И теперь они требуют выкуп за неопубликование этих кодов, и конечно я очень не хочу их опубликования, ведь это собственность компании, и она даже может начать юридическое преследование за утечку. 

SSH-ключ доступа к ноутбуку они, разумеется, сменили (поэтому мы с тобой и не смогли к нему подключиться), чтобы я не смог ничего исправить самостоятельно.

Я получил от них такое вот письмо:
«Привет. Кажется, сегодня не твой день, ведь твои данные стали нашими. От лица sp0rk b4gel искренне поздравляю тебя с этим. Если не хочешь крайне неприятных последствий, перечисли 0.2 биткоина на 12d1jWjmreNVfE5SKVrhm5T2r6D6bXdS4H, а способ сам найдешь, ты же программист. И да, если тебе интересно, как мы тебя хакнули, то намекаем – зря ты принимал участие в том дырявом проекте для студии Сокол…»Что мне делать?


"
/ru/post/546802/,"благотворительность,nft,монетизация,блокчейн","Криптовалюты,Киберпанк,Будущее здесь,Монетизация игр,Распределённые системы",True,,Ermolaev-Dmitry,6,0,0,2000,13,"В 2021-м году вся сеть пестрит сообщениями об рекордных продажах NFT: карточки спортсменов и работы художников разлетаются на раз. Но для людей старой школы, NFT довольно странная вещь - так как скопировать без потери качества медиа-файл который в нем заключен может любой и вроде как защиты никакой нет... Но! Имя автора и владельца NFT  остаются неизменными и подтверждаются в любой момент независимыми и защищенными записями в блокчейн. Так в чем же феномен такого успеха NFT? Феномен успеха NFTСкорее всего феномен NFT объясняется тем что его суть есть объединение четырех разных сущностей:  NFT - это суть вещь, цифровая вещь,NFT  - это суть благотворительность,NFT  - это суть награда, дающая славу,NFT - это суть будущая прибыль.Такая совокупность  близка к сути коллекционирования, но является все же новым витком развития как благотворительности так и коллекционирования.NFT как вещьТак как это цифровой актив (токен), выпущенный на блокчейн платформе, то, хоть это и электронная запись в базе данных, но благодаря особым математическим защитам и порядку работы блокчейн-технологии, эти электронные записи превращаются в вещь, которую можно передавать между владельцами - так же как мы передаем обычные вещи из рук в руки. Только вместо рук в блокчейн используются счета.NFT как благотворительностьПосудите сами, ведь кто выпускает NFT? Художники, певцы, фан-клубы и т.д.  Продавая эти токены они в первую очередь получают донат. Вдобавок на некоторых площадках, каждая последующая перепродажа, так же, довольно ощутимый процент отдает автору NFT (его эмитенту). Чем вам не аналог благотворительных аукционов? Осмелюсь предположить что скоро NFT начнут выпускать самые обычные благотворительные фонды и даже церковь!NFT для самолюбияФакт свершения благотворительности при покупке NFT выражен самим этим токеном, который переходит на счет благотворителя. И хоть этот счет анонимный, но все же его владелец может похвастаться в узком кругу своих друзей и знакомых раскрыв им факт владения этим счетом. Вдобавок, в некоторых блокчейн средах, например в блокчейн Erachain, можно вообще публично привязать свой счет к цифровому профилю персоны и тогда весь мир узнает, что именно вы являетесь меценатом!NFT как инструмент доходаРедкость и невосполняемость NFT подразумевают, что со временем, этот редкий актив будет только дорожать. Отсюда есть надежда у благотворителя, что в будущем он возможно получит еще и доход от перепродажи своей редкой, хоть и цифровой, вещи.ИтогиПодводим итоги: NFT это новое и довольно успешное решение, которое удовлетворяет сразу нескольким потребностям разных участников рынка. Будущее у такой сущности я вижу довольно радужным. Думаю скоро оно войдет в нашу обычную жизнь.Written with StackEdit."
/ru/news/t/549714/,"криптография,nft,ethereum,невзаимозаменяемые токены,блокчейн",Криптография,True,,AnnieBronson,38,0,0,6000,9,"Люди, которые приобретают NFT-токены, начали замечать, что купленные ими объекты пропадают. Как объяснили представители торговой площадки OpenSea, одного из крупнейших поставщиков невзаимозаменяемых токенов, проблема кроется в принципе работы NFT, который покупатели не всегда понимают.В прошлом месяце Том Куеннен из Онтарио приобрел за $500 в криптовалюте JPEG-изображение Moon Ticket от DarpaLabs, коллектива анонимных цифровых художников. Он купил NFT через торговую площадку OpenSea и планировал перепродать. Неделю спустя Куеннен открыл свой цифровой «кошелек» и столкнулся ошибкой 404; изображение, которое он ожидал увидеть на странице, исчезло. Как пишет Vice, Куеннен — не первый покупатель NFT, который пожаловался на то, что токены исчезают. Один из пользователей Reddit под ником elm099 пожаловался на то, что NFT под названием Big Boy Pants исчез из его кошелька. В этом случае пользователь мог видеть транзакцию, зарегистрированную в блокчейне, но не мог найти само изображение. Как объясняет Эд Клемент, менеджер сообщества OpenSea, когда человек приобретает NFT, в большинстве случаев он не покупает произведение искусства или даже файл изображения. Вместо этого приобретается небольшой фрагмент кода, который ссылается на файл мультимедиа, расположенный где-то в интернете. Сами цифровые произведения искусства не регистрируются в блокчейне при совершении покупки. При покупке, скорее, создается криптографическая подпись, которая при декодировании указывает на изображение, размещенное в другом месте. Поэтому, когда Куеннен приобрел Moon Ticket, в самой цепочке блоков не было файла JPEG, а был только сертификат, указывающий на URL. И этот указатель, пояснил Клементс, может быть заблокирован по ряду причин, включая нарушение условий торговой площадки. Нарушения авторских прав и кража произведений искусства — характерная черта развивающегося пространства NFT, указывают в OpenSea. А в случае, если NFT был фактически удален в источнике, а не заблокирован за нарушение, он не будет отображаться независимо от того, на каком веб-сайте он был размещен. Как рассказал Куеннен, он сомневался, что его NFT нарушает положения и условия OpenSea, и он не получил никаких предупреждений по этому поводу. Он сказал, что не смог даже найти запись самого токена в блокчейне, хотя сумел просмотреть сведения о транзакции, что показалось ему странным, так как даже если художественное произведение было удалено, запись все равно должна быть доступна.Как выяснилось, проблема могла быть связана с форматом токена. NFT обычно представлены в виде токена ERC-721. Узнать местонахождение этого токена просто. Например, торговая площадка NFT SuperRare отправляет токены прямо в кошельки покупателей, где их можно довольно легко отслеживать. OpenSea, однако, экспериментирует с новым вариантом токена: ERC-1155, или «мультитокеном». Этот стандарт токенов еще не совместим с Etherscan — сервисом, на котором можно посмотреть статистику сети Ethereum. Это означает, что ERC-1155 не отображаются, даже если находятся в блокчейне.Случай Куеннена сводился к двум причинам: нарушение условий обслуживания в OpenSea, которое привело к блокировке изображения, и нечитаемый стандарт ERC-1155, который сделал его недоступным для Etherscan. В OpenSea посоветовали Куеннену подключить свой кошелек к другой платформе, например, к Rarible, где токен, возможно, не заблокирован. Куеннен сделал именно это, однако на вкладке по-прежнему отображается пустая рамка, где должно было быть изображение. Изображение либо заблокировано, либо удалено.Как подчеркивает Vice, все это является иллюстрацией общей проблемы с Ethereum и криптовалютами в целом: несмотря на то, что они неизменяемы и не подлежат взлому, пользоваться ими можно только через ненадежные сторонние приложения."
